dataset_id,license_readiness,schema_readiness,assay_readout_readiness,controls_readiness,leakage_risk,task_fit,decision,evidence,next_action
overath_binder_success_2025,medium_dataset_cc_by_4_article_cc_by_nc_nd,partial_final_dataset_header_scanned,binary_binder_label_present,partial_binder_true_false_present_but_controls_source_dependent,medium_for_calibration_high_for_generation,T3_ranking_rescoring_scoring_calibration,calibration,"final_dataset.csv has 3676 rows 312 columns 15 nonblank targets 394 binder=True 3275 binder=False 7 blank target rows; external file not tracked",clean blank target rows and audit source overlap before sampling
pepbi_dryad_2025,unknown,not_scanned,thermodynamic_labels_reported_not_verified,unknown,medium,T2_affinity_calibration,test_candidate_pending_license_schema,candidate_benchmark_datasets.csv reports 329 protein-peptide complexes,verify Dryad license and field schema
pepmerge_pepbdb_qbiolip,unknown,not_scanned,unknown,unknown,high,T2_D_peptide_generation_reference_leakage_source,background_leakage_source,D-Flow route references PepMerge/PepBDB/Q-BioLip but exact access and split are not audited,map train/test split before any benchmark use
pepmirror_pepbench_protfrag,partial_repo_mit_dataset_unknown,not_scanned,wet_lab_subset_reported_not_extracted,unknown,high,T2_D_peptide_generation_reference_leakage_source,background_leakage_source,PepMirror repo and paper route indicate LNR/PepBench/ProtFrag resources,extract resource list and benchmark overlap
chang_af2_ranking_cases_2023,unknown,literature_tables_not_extracted,experimental_affinity_reported,competitive_peptide_pairs_reported,medium,T1_T2_small_ranking_calibration,calibration_pending_extraction,benchmark_literature_lessons and candidate dataset row,extract receptor peptide affinity table
pepbenchmark_2026,unknown,not_scanned,task_dependent,no,medium,peptide_property_developability_background,background,PepBenchmark/PepBenchData metadata only,select only subsets relevant to developability proxies
gpcr_peptide_design_benchmark_2026,unknown,not_scanned,experimental_success_context_to_extract,known_complexes_reported,medium,T2_T3_GPCR_peptide_design_background,background_or_test_candidate_pending_fulltext,Zotero card reports 124 known GPCR-peptide complexes and method comparison context,extract supplement and decide if peptide-specific target candidates are usable
